Title,Note,URL,Tags,Comment
,,,,
The Gold History of Nakashi Jewellery,,https://www.mygoldguide.in/sites/default/files/inline-images/Coimbatore--jewellery-article-2-6.jpg,,
"Vaikuntha Vishnu | India (Jammu & Kashmir, ancient kingdom of ...",,https://images.metmuseum.org/CRDImages/as/original/DT5253.jpg,,
"Buy Indian Artifacts, Ancient Artifacts, Harappan Art Online ...",,https://cdn.shopify.com/s/files/1/0549/4092/6195/collections/Dhokra_Harappan_Dancing_Girl.jpg?v=1682684965,,
The Blind Men and the Elephant,,https://www.adventisthealthcare.com/app/files/public/4aa30e1c-da28-45cd-95ba-b3aaaeccb4da/Content%20Hub/HUB-MissionMoment-BlindElephantCartoon.jpeg,,
